{
  "schema_version": "1.0",
  "scope": "dataset",
  "scene_key": "house-22",
  "scene_file": "house-22-schnitt-garage.jpg",
  "scene_tag": "schnitt",
  "scene_orientation": null,
  "scene_level": null,
  "image_size_px": [
    1511,
    751
  ],
  "labels": [
    {
      "type": "component_line",
      "geometry": {
        "polyline": [
          [
            335,
            505
          ],
          [
            835,
            505
          ]
        ]
      },
      "attributes": {
        "line_kind": "geschoss"
      },
      "id": "lab-03991f9e05",
      "status": "readable"
    }
  ]
}