{
  "schema_version": "1.0",
  "scope": "dataset",
  "scene_key": "house-21",
  "scene_file": "house-21-elevation-rechte-giebel.jpg",
  "scene_tag": "ansicht",
  "image_size_px": [
    926,
    936
  ],
  "labels": [
    {
      "id": "27a2008b-dd10-4766-abea-2360b7bd99db",
      "type": "height_mark",
      "geometry": {
        "anchor": [
          789.3167724609375,
          642.2471313476562
        ]
      },
      "attributes": {
        "value_mm": null,
        "datum": null,
        "reference_line_id": null
      },
      "status": "readable",
      "relations": [],
      "created_at": "2026-05-27T16:46:34.922Z",
      "updated_at": "2026-05-27T16:46:34.922Z"
    },
    {
      "id": "dc95eb79-e760-4765-9a66-7ff8c4196995",
      "type": "view_opening",
      "geometry": {
        "top_edge": [
          [
            439.60845947265625,
            356.8337707519531
          ],
          [
            503.35638427734375,
            356.8337707519531
          ]
        ],
        "bottom_edge": [
          [
            439.60845947265625,
            421.9051208496094
          ],
          [
            503.35638427734375,
            421.9051208496094
          ]
        ]
      },
      "attributes": {
        "opening_kind": "window",
        "frame_visible": true
      },
      "status": "readable",
      "relations": [],
      "created_at": "2026-05-27T16:46:46.745Z",
      "updated_at": "2026-05-27T16:46:46.745Z"
    },
    {
      "id": "7027e0f8-c1ca-4cfe-a514-49586e1de7cd",
      "type": "component_line",
      "geometry": {
        "polyline": [
          [
            321.1473693847656,
            704.9271850585938
          ],
          [
            782.0501708984375,
            639.93701171875
          ],
          [
            775.168212890625,
            449.5543518066406
          ],
          [
            524.8350830078125,
            148.87721252441406
          ],
          [
            304.0448913574219,
            455.8398742675781
          ],
          [
            322.21673583984375,
            704.7648315429688
          ]
        ]
      },
      "attributes": {
        "line_kind": "dachschraege"
      },
      "status": "readable",
      "relations": [],
      "created_at": "2026-05-27T17:52:14.366Z",
      "updated_at": "2026-05-27T17:52:14.366Z"
    }
  ],
  "annotated_by": "jhoetter",
  "annotated_at": "2026-05-27T17:52:44.382Z"
}