{
  "schema_version": "1.0",
  "scope": "dataset",
  "scene_key": "house-22",
  "scene_file": "house-22-ansicht-sued.jpg",
  "scene_tag": "ansicht",
  "scene_orientation": "south",
  "scene_level": null,
  "image_size_px": [
    1990,
    772
  ],
  "labels": [
    {
      "type": "view_opening",
      "geometry": {
        "shape": "polygon",
        "polygon": [
          [
            745,
            440
          ],
          [
            865,
            440
          ],
          [
            865,
            680
          ],
          [
            745,
            680
          ]
        ]
      },
      "attributes": {
        "opening_kind": "window"
      },
      "id": "lab-f5eb661b1e",
      "status": "readable"
    }
  ]
}