{
  "schema_version": "1.0",
  "scope": "dataset",
  "scene_key": "house-22",
  "scene_file": "house-22-floorplan-eg@600.jpg",
  "scene_tag": "grundriss",
  "scene_orientation": null,
  "scene_level": "eg",
  "image_size_px": [
    4636,
    3446
  ],
  "annotated_by": "jhoetter",
  "annotated_at": "2026-05-30T20:17:01.793Z",
  "labels": [
    {
      "type": "wall",
      "status": "readable",
      "geometry": {
        "start": [
          1254,
          1126
        ],
        "end": [
          2302,
          1146
        ]
      },
      "attributes": {
        "thickness_mm": 240
      },
      "notes": "exterior top",
      "id": "lab-34b1d9905c"
    },
    {
      "type": "wall",
      "status": "readable",
      "geometry": {
        "start": [
          1220,
          1140
        ],
        "end": [
          1326,
          2244
        ]
      },
      "attributes": {
        "thickness_mm": 240
      },
      "notes": "exterior left",
      "id": "lab-e0faf08c69"
    },
    {
      "type": "wall",
      "status": "readable",
      "geometry": {
        "start": [
          1280,
          2198
        ],
        "end": [
          2300,
          2182
        ]
      },
      "attributes": {
        "thickness_mm": 240
      },
      "notes": "exterior bottom",
      "id": "lab-fef965bcce"
    },
    {
      "type": "wall",
      "status": "readable",
      "geometry": {
        "start": [
          2302,
          1724
        ],
        "end": [
          2326,
          1724
        ]
      },
      "attributes": {
        "thickness_mm": 240
      },
      "notes": "exterior notch step",
      "id": "lab-b627137b53"
    },
    {
      "type": "wall",
      "status": "readable",
      "geometry": {
        "start": [
          2308,
          1724
        ],
        "end": [
          2332,
          2250
        ]
      },
      "attributes": {
        "thickness_mm": 240
      },
      "notes": "exterior right-lower",
      "id": "lab-7cb1564313"
    },
    {
      "id": "lab-6c2176b1fe",
      "type": "wall",
      "status": "readable",
      "geometry": {
        "start": [
          2612,
          1460
        ],
        "end": [
          2892,
          1468
        ]
      },
      "attributes": {
        "thickness_mm": 240
      },
      "notes": "garage top"
    },
    {
      "id": "lab-312eb3d1ed",
      "type": "wall",
      "status": "readable",
      "geometry": {
        "start": [
          2882,
          1508
        ],
        "end": [
          2884,
          2180
        ]
      },
      "attributes": {
        "thickness_mm": 240
      },
      "notes": "garage right (thick black band, conf 1.0)"
    },
    {
      "id": "lab-6404da1e62",
      "type": "wall",
      "status": "readable",
      "geometry": {
        "start": [
          2610,
          2242
        ],
        "end": [
          2892,
          2242
        ]
      },
      "attributes": {
        "thickness_mm": 240
      },
      "notes": "garage bottom"
    },
    {
      "type": "wall",
      "status": "readable",
      "geometry": {
        "start": [
          1310,
          1346
        ],
        "end": [
          1632,
          1348
        ]
      },
      "attributes": {
        "thickness_mm": 150
      },
      "notes": "interior DU/WC 103 | Kueche 104",
      "id": "lab-5a8f47bc8a"
    },
    {
      "type": "wall",
      "status": "readable",
      "geometry": {
        "start": [
          1642,
          1344
        ],
        "end": [
          1640,
          1652
        ]
      },
      "attributes": {
        "thickness_mm": 150
      },
      "notes": "interior Kueche 104 | Diele 115",
      "id": "lab-6405bc3eb3"
    },
    {
      "type": "wall",
      "status": "readable",
      "geometry": {
        "start": [
          2056,
          1224
        ],
        "end": [
          2058,
          1652
        ]
      },
      "attributes": {
        "thickness_mm": 150
      },
      "notes": "interior Diele 115 | stair core (left)",
      "id": "lab-ba27785c01"
    },
    {
      "type": "wall",
      "status": "readable",
      "geometry": {
        "start": [
          2058,
          1656
        ],
        "end": [
          2302,
          1664
        ]
      },
      "attributes": {
        "thickness_mm": 150
      },
      "notes": "interior stair core | Wohnen/Essen 105 (bottom)",
      "id": "lab-8ecf268456"
    },
    {
      "type": "wall",
      "status": "uncertain",
      "geometry": {
        "start": [
          2058,
          1230
        ],
        "end": [
          2298,
          1236
        ]
      },
      "attributes": {
        "thickness_mm": 150
      },
      "notes": "interior stair core | Gast 113 (top); faint, max refine conf 0.62",
      "id": "lab-14112ac4cb"
    },
    {
      "type": "wall",
      "status": "readable",
      "geometry": {
        "start": [
          2360,
          1134
        ],
        "end": [
          2392,
          1700
        ]
      },
      "attributes": {
        "thickness_mm": 240
      },
      "notes": "exterior right-upper added cycle3",
      "id": "lab-c3a1right1"
    },
    {
      "type": "wall",
      "status": "readable",
      "geometry": {
        "start": [
          1288,
          1310
        ],
        "end": [
          1656,
          1286
        ]
      },
      "attributes": {
        "thickness_mm": 150
      },
      "notes": "interior c5 horiz",
      "id": "lab-c5c1"
    }
  ]
}