{
  "schema_version": "1.0",
  "scope": "dataset",
  "scene_key": "house-22",
  "scene_file": "house-22-schnitt-gebaeude.jpg",
  "scene_tag": "schnitt",
  "scene_orientation": null,
  "scene_level": null,
  "image_size_px": [
    2550,
    1053
  ],
  "labels": [
    {
      "type": "height_mark",
      "geometry": {
        "anchor": [
          1790,
          160
        ]
      },
      "status": "readable",
      "attributes": {
        "value_mm": 7210,
        "datum": "first"
      },
      "id": "lab-ec9e206186"
    },
    {
      "type": "height_mark",
      "geometry": {
        "anchor": [
          1798,
          318
        ]
      },
      "status": "readable",
      "attributes": {
        "value_mm": 4580,
        "datum": "traufe"
      },
      "id": "lab-ac6d91a580"
    },
    {
      "type": "height_mark",
      "geometry": {
        "anchor": [
          1786,
          448
        ]
      },
      "status": "readable",
      "attributes": {
        "value_mm": 2970,
        "datum": "geschoss"
      },
      "id": "lab-095f79b719"
    },
    {
      "type": "height_mark",
      "geometry": {
        "anchor": [
          1786,
          609
        ]
      },
      "status": "readable",
      "attributes": {
        "value_mm": 0,
        "datum": "ok_ffb"
      },
      "id": "lab-21c78ab903"
    },
    {
      "type": "height_mark",
      "geometry": {
        "anchor": [
          1788,
          775
        ]
      },
      "status": "readable",
      "attributes": {
        "value_mm": -2860,
        "datum": "geschoss"
      },
      "id": "lab-1aec083d9b"
    }
  ]
}