{
  "schema_version": "1.0",
  "scope": "dataset",
  "scene_key": "house-21",
  "scene_file": "house-21-floorplan-eg-detail.jpg",
  "scene_tag": "grundriss",
  "image_size_px": [
    3308,
    2339
  ],
  "labels": [
    {
      "id": "b36f5fc3-adc6-4570-90fd-6ef44d032d66",
      "type": "wall",
      "geometry": {
        "start": [
          873.6024780273438,
          432.6948547363281
        ],
        "end": [
          873.6024780273439,
          1383.5906358378743
        ]
      },
      "attributes": {
        "thickness_mm": 365
      },
      "status": "readable",
      "relations": [],
      "created_at": "2026-05-27T16:57:39.593Z",
      "updated_at": "2026-05-27T16:57:39.593Z"
    },
    {
      "id": "de08b432-d954-4c6e-9ff1-7909375fa30f",
      "type": "wall",
      "geometry": {
        "start": [
          873.6024780273439,
          1383.5906358378743
        ],
        "end": [
          2943.097412109375,
          1383.5906358378743
        ]
      },
      "attributes": {
        "thickness_mm": 365
      },
      "status": "readable",
      "relations": [],
      "created_at": "2026-05-27T16:57:41.590Z",
      "updated_at": "2026-05-27T16:57:41.590Z"
    },
    {
      "id": "0a4669ad-c799-4373-8960-744628283b23",
      "type": "wall",
      "geometry": {
        "start": [
          2994.3486328125,
          1379.0933213847493
        ],
        "end": [
          2994.3486328125,
          495.06890869140625
        ]
      },
      "attributes": {
        "thickness_mm": 365
      },
      "status": "readable",
      "relations": [],
      "created_at": "2026-05-27T16:57:43.267Z",
      "updated_at": "2026-05-27T17:01:51.726Z"
    },
    {
      "id": "02aa3e25-25bd-4130-ae63-b87d40d2d31c",
      "type": "wall",
      "geometry": {
        "start": [
          2943.097412109375,
          499.56622314453125
        ],
        "end": [
          873.6024780273438,
          432.6948547363281
        ]
      },
      "attributes": {
        "thickness_mm": 365
      },
      "status": "readable",
      "relations": [],
      "created_at": "2026-05-27T16:57:46.035Z",
      "updated_at": "2026-05-27T17:01:45.038Z"
    },
    {
      "id": "2b0651d3-92e5-4245-8e02-8f68701c3abd",
      "type": "wall",
      "geometry": {
        "start": [
          873.6024780273438,
          432.6948547363281
        ],
        "end": [
          873.6024780273439,
          1383.5906358378743
        ]
      },
      "attributes": {
        "thickness_mm": 365
      },
      "status": "readable",
      "relations": [],
      "created_at": "2026-05-27T18:20:32.193Z",
      "updated_at": "2026-05-27T18:20:32.193Z"
    },
    {
      "id": "eaa6717d-803f-4331-b6f3-0d7df595c6eb",
      "type": "wall",
      "geometry": {
        "start": [
          873.6024780273439,
          1383.5906358378743
        ],
        "end": [
          2943.097412109375,
          1383.5906358378743
        ]
      },
      "attributes": {
        "thickness_mm": 365
      },
      "status": "readable",
      "relations": [],
      "created_at": "2026-05-27T18:20:35.472Z",
      "updated_at": "2026-05-27T18:20:35.472Z"
    },
    {
      "id": "892d0ded-fe2e-4214-9c64-b6adce540d51",
      "type": "wall",
      "geometry": {
        "start": [
          2943.097412109375,
          1383.5906358378743
        ],
        "end": [
          2943.097412109375,
          499.56622314453125
        ]
      },
      "attributes": {
        "thickness_mm": 365
      },
      "status": "readable",
      "relations": [],
      "created_at": "2026-05-27T18:20:37.295Z",
      "updated_at": "2026-05-27T18:20:37.295Z"
    },
    {
      "id": "4f3f6afd-a823-40b9-8b0f-dd13e7700258",
      "type": "wall",
      "geometry": {
        "start": [
          2943.097412109375,
          499.56622314453125
        ],
        "end": [
          873.6024780273433,
          499.5662231445315
        ]
      },
      "attributes": {
        "thickness_mm": 365
      },
      "status": "readable",
      "relations": [],
      "created_at": "2026-05-27T18:20:39.200Z",
      "updated_at": "2026-05-27T18:20:39.200Z"
    }
  ],
  "annotated_by": "jhoetter",
  "annotated_at": "2026-05-27T18:21:09.204Z"
}